{
  "schema_version": 1,
  "request_id": "stock-dairy-premarket-20261029-072518-et-01",
  "requested_at": "2026-10-29T11:29:21.428Z",
  "trade_date": "2026-10-29",
  "stage": "premarket",
  "mode": "premarket",
  "research_repository": "yuatom/stock-dairy",
  "research_repository_commit_sha": "68b63f6e8c322a82a3137c20c25692d7368f31cf",
  "market_data_contract_sha": "3384147a654abec11990201d321ae241d0af36ee",
  "transaction_id": "premarket-20261029-072518-et-01",
  "personal_state_proof": {
    "dynamic_state_read_sha": "f6126e73bacf72d9ff32b9e7df1ba07513f4eaaa",
    "blob_sha": "0392a34c368b90447732aa690ca807321adfcddb",
    "state_version": 5,
    "authority_state": "canonical",
    "content_hash_status": "unavailable_no_script",
    "content_sha256": null
  },
  "research_universe_resolution_status": "resolved"
}
